title,company,district,classification,work-type,description
Programmer ( PHP ),Hays Hong Kong Limited,Central and Western District,Developers/Programmers (Information & Communication Technology),Full time,"Key Responsibilities:Focused on intelligent automation and data-driven decision-making from inception to completion.Utilize AI and big data technologies to analyze complex business scenarios and derive actionable insights.Design and develop tailored solutions that address specific business needs and requirements.Work closely with cross-functional teams, including data scientists, engineers, and business analysts, to ensure project success.Monitor and evaluate the performance of implemented solutions, making adjustments as necessary to optimize outcomes.Stay abreast of the latest trends and advancements in AI, big data, and intelligent automation to continuously improve project outcomes.Qualifications:Higher Diploma in Computer Science, Data Science, Engineering, or a related field.Proven experience in leading projects involving AI, big data, and intelligent automation.Proficiency in programming languages such as Python, R and experience with big data platformsStrong analytical and problem-solving skills, with the ability to interpret complex data and make data-driven decisions.Excellent communication and interpersonal skills, with the ability to convey technical concepts to non-technical stakeholders.Demonstrated leadership abilities with a track record of successfully managing cross-functional teams.If you're interested in this role, click 'apply now' to forward an up-to-date copy of your CV to[email protected]or contact to22307436If this job isn't quite right for you, but you are looking for a new position, please contact us for a confidential discussion on your career."
Associate Data Scientist,JFE Consulting Limited,"Central, Central and Western District",Developers/Programmers (Information & Communication Technology),Full time,"ResponsibilitiesServe as a key client-facing contributorCollaborate with the business to translate unstructured business questions into quantitative problemsProvide advanced analytics support, including machine learning, big data, and sophisticated statistical modelingAdvise on appropriate analytical models based on available data, technology, and platformEvaluate machine learning algorithms and models, and provide technical recommendations to business units for decision-makingPrototype advanced analytics and machine learning solutions, and optimize them iteratively for business partnersMonitor data science product performance to ensure the delivery of expected business value, and initiate necessary corrective actionsAnticipate needs and lead the implementation of capabilities such as data modeling, algorithms, new technology, and partnershipsRequirementsMaster's degree or equivalent in Data Science, Computer Science, Econometrics, Mathematics, Operations Research, Statistics, or a related discipline3-6 years of work experience in data science, with a proven track record of leveraging large amounts of data to drive significant business impact, including at least 1 year of optimization experienceAdvanced analytical skills, experience in recommending appropriate algorithms and methodologies for problem-solving and decision-making, leveraging both logic and creativityProficiency in statistical analysis tools and machine learning languages, such as Python/R, as well as experience with big data tools (e.g., Spark) and query languagesPreferred experience in advanced machine learning topics (e.g., NLP, Graph Neural Networks, Probabilistic Models)Strong communication skills to articulate ideas verbally and in written form for audiences at different levelsSolid understanding of the latest analytics technology, concepts, and trends in platforms and toolsGood knowledge of database concepts, data modeling, business intelligence disciplines, and data management toolsExperience with the AWS cloud stack is an advantageExperience with data visualization tools (e.g., Alteryx, QlikSense, PowerBI) is an advantage"
Associate Business Analyst/ Junior Business Analyst,Macroview Telecom Limited,"Quarry Bay, Eastern District",Business/Systems Analysts (Information & Communication Technology),Full time,"Job Responsibilities:Collaborate with stakeholders to understand and document business requirements, processes, and objectives.Work closely with business users & IT to align the understanding of business goal, requirements and solution designConduct data and workflow analysis to identify areas for improvement and efficiencyParticipate in the development of business and functional requirements, use cases, and user storiesContribute to testing activities and assist in user trainingAssist in creating project documentation, including business requirement documents, test plans and user guidesRequirements:Degree holders in Business Administration, Information Systems or Computer Science related disciplines1-2 years of working experience in business analysis, solution development or data analysisExperience in business requirement elicitation & analysis is preferredExperience in Project Management is an advantageExperience in CRM, ERP and helpdesk systems is an advantageExcellent documentation, presentation, and interpersonal skillsGood analytical & problem-solving skillsIndependent, proactive, innovative, detail-minded and able to work under pressureFresh graduates will also be considered"
Data Science Lead,Klook Travel Technology Limited,Hong Kong,Business/Systems Analysts (Information & Communication Technology),Full time,"About the roleWe're looking for a passionate data science leader to spearhead our MarTech initiatives and unlock the full potential of data-driven demand marketing. This role is heavily focused on building and deploying models for predictive and prescriptive analytics, not just descriptive reporting. I.e. Less on descriptive (5-10%), more prescriptive and predictive (>80%)What you’ll do:Meaningfully improve business results by leveraging cutting-edge data science and machine learning techniquesLead the development and deployment of production-ready ML (predictive/prescriptive) models for tasks:Automated anomaly detection and root cause analysis for discovered anomaliesHighly accurate forecasting models that combine internal and market demand signals.More accurate forecasting model based on both internal and market demand signalsUser search intent understanding and optimal landing page experience matching.Understanding user’s search intent and matching it to the best landing page experienceIn-session propensity scoringBuild predictive models and even prescriptive models that deploy to productionEither AWS or GCPMonitoring of data pipeline and data qualityMonitoring of model drift, if anyA/B different models in productionTranslate complex data science concepts into clear, actionable insights for senior management and stakeholders.Lead and mentor a team of junior analysts and developersWhat you’ll need:Must-Haves:5+ years of hands-on experience in Data Science and Machine Learning with clear and strong track record of deliverables that improved business outcomesProficiency in building and deploying models to production using either AWS or GCP cloud platforms.Clear communication (in English) and can translate complicated ideas to stakeholders like a 5th graderCan lead and guide junior developers and budding data scientistsStrong sense of ownership and bias towards actionNice-to-haves:Python fluency (+++)NLP, LLMs including embeddings, vector DBs, and neural nets (++)Experimentation setup and post mortems both frequentist & bayesian (++)Another language beyond English"
Programmer ( PHP ),Hays Hong Kong Limited,Central and Western District,Developers/Programmers (Information & Communication Technology),Full time,"Key Responsibilities:Focused on intelligent automation and data-driven decision-making from inception to completion.Utilize AI and big data technologies to analyze complex business scenarios and derive actionable insights.Design and develop tailored solutions that address specific business needs and requirements.Work closely with cross-functional teams, including data scientists, engineers, and business analysts, to ensure project success.Monitor and evaluate the performance of implemented solutions, making adjustments as necessary to optimize outcomes.Stay abreast of the latest trends and advancements in AI, big data, and intelligent automation to continuously improve project outcomes.Qualifications:Higher Diploma in Computer Science, Data Science, Engineering, or a related field.Proven experience in leading projects involving AI, big data, and intelligent automation.Proficiency in programming languages such as Python, R and experience with big data platformsStrong analytical and problem-solving skills, with the ability to interpret complex data and make data-driven decisions.Excellent communication and interpersonal skills, with the ability to convey technical concepts to non-technical stakeholders.Demonstrated leadership abilities with a track record of successfully managing cross-functional teams.If you're interested in this role, click 'apply now' to forward an up-to-date copy of your CV to[email protected]or contact to22307436If this job isn't quite right for you, but you are looking for a new position, please contact us for a confidential discussion on your career."
Associate Business Analyst/ Junior Business Analyst,Macroview Telecom Limited,"Quarry Bay, Eastern District",Business/Systems Analysts (Information & Communication Technology),Full time,"Job Responsibilities:Collaborate with stakeholders to understand and document business requirements, processes, and objectives.Work closely with business users & IT to align the understanding of business goal, requirements and solution designConduct data and workflow analysis to identify areas for improvement and efficiencyParticipate in the development of business and functional requirements, use cases, and user storiesContribute to testing activities and assist in user trainingAssist in creating project documentation, including business requirement documents, test plans and user guidesRequirements:Degree holders in Business Administration, Information Systems or Computer Science related disciplines1-2 years of working experience in business analysis, solution development or data analysisExperience in business requirement elicitation & analysis is preferredExperience in Project Management is an advantageExperience in CRM, ERP and helpdesk systems is an advantageExcellent documentation, presentation, and interpersonal skillsGood analytical & problem-solving skillsIndependent, proactive, innovative, detail-minded and able to work under pressureFresh graduates will also be considered"
Data Science Lead,Klook Travel Technology Limited,Hong Kong,Business/Systems Analysts (Information & Communication Technology),Full time,"About the roleWe're looking for a passionate data science leader to spearhead our MarTech initiatives and unlock the full potential of data-driven demand marketing. This role is heavily focused on building and deploying models for predictive and prescriptive analytics, not just descriptive reporting. I.e. Less on descriptive (5-10%), more prescriptive and predictive (>80%)What you’ll do:Meaningfully improve business results by leveraging cutting-edge data science and machine learning techniquesLead the development and deployment of production-ready ML (predictive/prescriptive) models for tasks:Automated anomaly detection and root cause analysis for discovered anomaliesHighly accurate forecasting models that combine internal and market demand signals.More accurate forecasting model based on both internal and market demand signalsUser search intent understanding and optimal landing page experience matching.Understanding user’s search intent and matching it to the best landing page experienceIn-session propensity scoringBuild predictive models and even prescriptive models that deploy to productionEither AWS or GCPMonitoring of data pipeline and data qualityMonitoring of model drift, if anyA/B different models in productionTranslate complex data science concepts into clear, actionable insights for senior management and stakeholders.Lead and mentor a team of junior analysts and developersWhat you’ll need:Must-Haves:5+ years of hands-on experience in Data Science and Machine Learning with clear and strong track record of deliverables that improved business outcomesProficiency in building and deploying models to production using either AWS or GCP cloud platforms.Clear communication (in English) and can translate complicated ideas to stakeholders like a 5th graderCan lead and guide junior developers and budding data scientistsStrong sense of ownership and bias towards actionNice-to-haves:Python fluency (+++)NLP, LLMs including embeddings, vector DBs, and neural nets (++)Experimentation setup and post mortems both frequentist & bayesian (++)Another language beyond English"
Junior Data Analyst ( Multiple openings),Robert Walters (HK) Ltd,Central and Western District,Business/Systems Analysts (Information & Communication Technology),Full time,"-Responsibilities* Work with data owners on processes to enable and ensure data quality, evangelizing the importance of good data hygiene* Streamline and automate internal process to ensure efficient and effective data generation and analytics processes are in place. Drive continuous improvement in the team's output in terms of quality and efficiency.* Partner with regional stakeholders to identify areas of optimization in data discovery, ETL, storage, enrichment, and usage* Be a subject matter expert in data to support the increasing demands from business and other analytics / data science teamsRequirements* 1-3 years of data analytics experience in with hands on experience in Python and SQL/ SAS* University graduate majoring in mathematics, statistics, business analytics, information system, computer science, or other related discipline* Strong ability to analyze and interpret business and financial data* Knowledge in building dashboard by using Tableau, Power BI or any equivalent tools would be an advantage"
Mobile/E-Banking: Junior IT Business Analysts (Major Bank),IT Solutions Ltd.,Hong Kong,Business/Systems Analysts (Information & Communication Technology),Full time,"We are searching on behalf of a major bank for a number ofJunior IT Business AnalystsResponsibilities:Create detailed business analysis, outline problems and professional solutions to users and developersFormulate Test Plans and conduct User Acceptance TestWork closely with business users and developers to ensure effective project implementationAssist to manage IT project implementationRequirements:Degree in Business Studies or Computer Science or related disciplineWith or without Working experienceStrong attentions to detail and good problem-solvingStrong communications and presentation skillsGood written and spoken Chinese and EnglishFresh Graduates, or with working experience in other areas are welcome to applyBenefits:Attractive remuneration will be offered to the successful candidate.Excellent opportunity to further develop your professional skills in major banking environment.Gain expertise in the full range of operations of Payment Systems in the BankIf you are interested, please send your resume in MS Word format, specifying your availability, current and expected salaries to:jobs @itsolutions.com.hkorPlease click the Apply Now button and attach your cv in MS Word Format, specifying your availability, current and expected salaries.Personal data collected will be used for recruitment purposes only.IT Solutions Ltd.Suite 210221/F Lucky Building39 Wellington StreetCentral, Hong Kong(P.S. We do not process applications from overseas for this position)"
(Senior) Data Scientist,Tenth Revolution Group,Central and Western District,Business/Systems Analysts (Information & Communication Technology),Full time,"My client is one of the world's leading company in minor bulk shipping industry, whose headquarter in Hong Kong, with network of 14 offices in 6 continents across. They're currently looking for an experienced Data Scientist to join the internal data team to play a key role in building and productionizing strategic machine learning models that can drive business critical decision making and maximise business value.Role & ResponsibilitiesIdentify and solve business problems by using data-driven techniquesAnalyze raw data to find patterns to check data quality and provide insightsDevelop, deploy and maintain machine learning models to enhance business workflowsPresent findings and workable solutions to both technical and non-technical stakeholdersSkills & QualificationsAt least 4 years of experience applied data scientist a business environmentSignificant experience with Python and SQLExperience with developing machine learning model and running machine learning in production, MLOpsUnderstanding of probability and statistics, with ability to think from first principlesExperience within shipping or transportation sector is an advantageExperience in Bayesian Hierarchical modeling is an advantageProficiency in both written and spoken EnglishThis is a fantastic opportunity and great project to work with 5 working days a week, comprehensive remuneration packages and training provided. We are hiring within the week and If you think this role is suitable for you please send your CV to[email protected]or call on+852 3018 0382."
Junior Data Center Operator (7x24 Shift) Salary range from $18000 to $20000,Tech Advance Consultancy Limited,"Cyberport, Southern District",Help Desk & IT Support (Information & Communication Technology),Full time,"Jobs Duties:Provide Technical Support services including: Data Centre operations, equipment maintenance and service provisioningProvide technical support services including fault reporting, troubleshooting, cable testing, equipment installation for external customersInstall and uninstall customer connectivity service, including circuit testing and labelingPerform cross connect related audit duties, record validation and housekeeping workSupport for local networking devicesIncident handling, problem troubleshooting and escalation to upper tierMaintain accurate records, document all problems, and prepare reportsDelivery of operation reports, management reportEnsure compliance with operation rules in managing customers' equipmentRequirements:Willing to perform 7 x 24 shift dutyCustomer focus with good communications and interpersonal skillsGood presentation skills and problem solving skillsDiscipline, self-initiative, self-motivateHands-on experience in hotline support and data center operations is preferred.Working experience in data center operation / technical support / hotline support is preferredImmediately available will be advantageFresh Graduates are WelcomeWorking location:  90% working in Kowloon Bay, 10% working in Cyberport.(Ref: KH)"
Data Engineer,Li & Fung (Trading) Ltd,"Lai Chi Kok, Sham Shui Po District",Business/Systems Analysts (Information & Communication Technology),Full time,"About usWe aspire to deliver value in global supply chains by living our values around people, partners and the planet. As new technologies disrupt the way consumers and businesses interact, Li & Fung is reimagining and creating supply chains for the future. Through our innovative products and end-to-end supply chain solutions, we aim to expand the realm of what is possible and create more value for more players along the supply chain.With our entrepreneurial spirit, we are using digital technologies to speed collaboration, drive innovation and enhance sustainability.  Our values form the basis of our culture, our brand and our business strategies. They define how we engage with our colleagues, with our customers and suppliers, our shareholders, and the communities in which we live and work.Here is what you need to know about this role ...As one of the key Data Engineers, you are expected to work on Azure Databrick and Power BI to help on the upcoming projects related to email analysis, employee data consolidation, project usage analysis, etc. You are also required to: -Manage and administer Azure Databricks platform, including policy and rules settingSupport data platforms like DataBrick, Oracle and Data WarehouseImplement and maintain security measures using Unity Catalogue and fine-grained security implementationsStay up-to-date with Databricks development and new featuresDesign and develop data pipelines using Azure Data Factory, ODBC/JDBC connections, and 3rd parties’ integration toolsUnderstand and work with in-house RDBMS-based application data modelsImplement practical master data management solutions in environments with conflicting sources of truthApply design best practices to facilitate efficient data pipeline debugging; andPerform other ad-hoc tasks as assignedYou might be a good fit if you have …A Bachelor's degree in Computer Science, Information Systems, or related discipline3-4 years' hands-on experience in data engineering and BI tools like Azure Databricks, Power BI, TableauPassionate about emerging technologiesSolid background in data pipeline development and cloud-based data solutionsStrong proficiency in SQL, Python, and Shell ScriptingExperience in Azure Data Factory and other ETL/ELT toolsFamiliarity with data integration tools such as Golden Gate or FivetranKnowledgeable in data security best practices and implementation; andExperience with RDBMS systems and data modelingStrong problem-solving skills, excellent communication abilities and a self-starter passionate in continuous learning in the rapidly evolving field of data engineeringYour profile will stand out if you additionally possess ...Azure certifications (e.g. Azure Data Engineer Associate)Knowledge of metadata management and master data management conceptsFamiliarity with DevOps practices and CI/CD pipelinesIf this sounds like you, Apply Now!  We offer the below benefits and perks: -Competitive salary with 13th month salary plus discretionary bonusHealth, dental, life and personal accident insurancesPaid days off + festival early leave + volunteer leaveSample sales and staff discount offer#lftrading #lifungIt’s alright if this is not what you are looking for! You can also join us on LF Talent Network by clicking HERE (https://lifung.wd3.myworkdayjobs.com/en-US/LiFung/introduceYourself). We will contact you when the right job opportunity comes up!As an equal opportunity employer, we shall consider all applicants regardless of gender, age, religion, marital status, race, sexual orientation, disability, disease, pregnancy, or trade union and/or political affiliation, and disregard all factors deemed inappropriate by local law and the International Labor Organization’s Declaration on Fundamental Principles and Rights at Work.About Li & FungAt Li & Fung, value has tangible meaning and we strive to deliver value to our stakeholders with each and every interaction.  We also live by our values of humility, entrepreneurship and family and they are at the core of our relationship with our people, our partners and our commitment to reduce the harmful impact of our industry on the planet.Since 1906 we have grown from our initial startup focused on trading porcelain and silk from China to the West to today’s multinational corporation, managing complex supply chains for brands and retailers worldwide. Over 118 years, Li & Fung has been developing networks and building long-term, meaningful relationships with our stakeholders.  Despite major changes and disruptions, innovation and creativity continue to drive our business.  We constantly experiment with new ways of working to deliver value to our customers and suppliers, our shareholders, and the communities in which we live and work. We are dedicated to changing how the world works and making life better for people everywhere.(Data collected will be used for recruitment purposes only.)"
