title,company,district,classification,work-type,description
Brand Partner Specialist - Territory (Data & AI),IBM China / Hong Kong Ltd,Hong Kong,Administrative Assistants (Administration & Office Support),Full time,"IntroductionAt IBM, work is more than a job – it’s a calling: To build. To design. To code. To consult. To think along with clients and sell. To make markets. To invent. To collaborate. Not just to do something better, but to attempt things you’ve never thought possible. Are you ready to lead in this new era of technology and solve some of the world’s most challenging problems? If so, lets talk.Your Role and ResponsibilitiesThe Software Solutions Brand Sales is responsible for developing solutions that address our client’s business needs and deliver client value, technical knowledge with integrated products knowledge is crucial. The Software Solutions Brand Sales will work to create solutions which are tailored to client’s business needs and integrate the capabilities in a way that is valued by the customer and superior to the competition through technical viewpoint. In this role, it is essential to be able to apply industry specific knowledge and experience to bring new business and technology insights to assigned clients, selling with technical capability on basic architectural view. Furthermore, you will work together with IBM partners and external system integration providers for selling software solutions by leveraging different approach of cold calling, digital marketing campaigns or any other innovative ways.Major Responsibilities:• Sell DataAI & Automation solutions with technical skillset.• Territory / pipeline management• Opportunity identification• Lead Proof of Concepts, demonstrations, client workshops and presentations• Quotes / pricing, and other proposal development activitiesRequired Technical and Professional Expertise• 8+yearsof experience as software sales.• 5+yearsin DataAI & Automation solution related fields.• Experienced sales background, solid record of achieving sales targets.• Excellentcommunicationskill inEnglishandChineseand Client Relationship Skills• Great teaming skills, with a focus on creating client value.Preferred Technical and Professional Expertise• Experience in channel development or expand partner ecosystem is preferred.• Experience in key account coverage role is preferred.• Experience to deliver sales pitch to C-level is preferred.• IT technical background is preferred."
"Engineer, Data Science (Data Engineer)",Company Confidential,"Kowloon City, Kowloon City District",Engineering - Software (Information & Communication Technology),Full time,"Who we are looking for:Creativity in new ideas and future focus vision.Collaboration with colleagues and the community at large.Work Smart, Play Smart!What you'll do:Study the AI technology trends and applications for industries, especially the manufacturing industry, so as to identify the potential solutions for industries’ productivity improvement and upgradingPropose and evaluate technical ideas with other functional units so as to design a suitable solution on order prediction, PHM, fault diagnosis, quality forecast and so on against the requirements and demandsDefine the technical development roadmap of AI technology applications so as to work out the R&D tasks and implementation planBe responsible for the development and optimization of the industrial AI and machine learning algorithms of the specific application fieldsLead project team to carry out R&D tasks against the plans and complete the projects (including R&D work, project documents, technical report and paper, patents, etc.) as scheduled with high standardBuild up and maintain a good network with other professional organization so as to acquire new technologies and create synergyYou'll be a good fit if you have/are:Master or above Degree in Computer Science, Mathematics, Statistics, Intelligent Systems, related disciplines or equivalentUnderstanding on AI and machine learning framework, such as Tensorflow, PyTorch, Pandas, Scikit-learn, etc., and experience in NodeJS, JavaScript, Python, R or similar languagesKnowledge of Linux and cloud application, such as Azure, AWS and GCP an advantageGood writing, presentation, communication and analytical skillsPassionate, self-motivated, and able to work independently and meet tight deadlinesApplicants may be considered for other positions if not matching the requirements of the subject positionNote: Applicant may be considered for other positions if not matching the requirements of the subject position.What we offer and What you’ll like here:Exciting new technology development (e.g. IoT, 5G, LoRA, AI etc.) to actualize your creative ideasOpportunities to work with our innovative and vibrant talentsEmbracing work flexibility (including Flexi-work hour and Flexi-location)Dynamic and energetic culture with smart outfits & sport shoesAcademic training scholarship to take your career up a notchMPF Top-up & dental benefitMedical benefits from Day 1 with extended coverage to dependent(s)"
Data Scientist,Cornerstone Global Partners,"Quarry Bay, Eastern District","Mathematics, Statistics & Information Sciences (Science & Technology)",Full time,職責描述：負責處理海量數據，進行建模和分析報告的編寫；通過研究客戶的基本信息、信用信息和行為日誌等數據，實現風險建模；應用機器學習技術解決金融科技相關場景中的問題，包括但不限於客戶獲取、風險控制和客戶關係維護；設計風控數據的收集與整合需求，構建風控數據模型數據管理倉庫和數據集市，探索自動化風控平台的實現方案。任職要求：學士及以上學歷，具有大數據分析和機器學習建模相關工作經驗者優先；熟悉數據庫和數據分析工具，能熟練運用SQL、Python、R、SAS等進行高效的數據處理、挖掘和分析；精通機器學習的基本原理和應用，對常見算法如GBDT、XGBoost、隨機森林和邏輯回歸有深入理解，具備深度學習經驗者將更具優勢；具備良好的邏輯分析能力，善於溝通和表達，能承受快節奏的工作壓力，願意不斷學習新知識；優秀的英文閱讀和交流能力將被視為加分項。
Research Assistant – Big Data Intelligence Centre,The Hang Seng University of Hong Kong,"Siu Lek Yuen, Sha Tin District",Research & Fellowships (Education & Training),Full time,"ResponsibilitiesThe appointee will assist the project leader in conducting research work. Research duties include, but not limited to, literature review, model development and data analysis.Applicants ShouldApplicants should:possess a bachelor’s degree or above in computer science, statistics or a related field;have experience in programming such as SAS, MATLAB, Python, R; andbe able to work independently."
Contract Junior Cybersecurity Analyst,Company Confidential,"Kowloon Bay, Kwun Tong District",Security (Information & Communication Technology),Full time,"DutiesDevelop and execute cybersecurity awareness program, phishing simulation, and training to promote and raise cybersecurity awareness among employees.Create engaging and relevant cybersecurity awareness materials that resonates with diverse audiences within the organization.Develop online and offline promotion and awareness contents, including but not limited to web pages, business reports, presentations, notification releases etc.Assist and coordinate cybersecurity risk assessment and ISO 27001 audit activities.Maintain and update records of security metrics, Key Performance Indicators of security controls, cybersecurity risk assessment and audit results.Assist in preparing cybersecurity reports and responding to user enquiries.Participate in ad hoc tasks and cybersecurity related projects as required.RequirementsDegree or Higher Diploma in Information Technology, Information Systems, Computer Science, Information Security, or related discipline.A minimum of 3 years relevant working experience.Possession of professional certificates in Certified Information Systems Security Professional (CISSP), Certified Information Systems Auditor (CISA) or equivalent will be advantageousGood understanding of threat landscape and trends, and act proactively on threat intelligenceDemonstrated ability to deliver engaging presentations and training sessions on security topics.Experience in strong graphic design will be a definite advantage.Be self-motivated, initiative with good problem solving and analytical skills.Ability to work independently while contributing to a strong teamwork environment.Strong interpersonal and communication skills in both written and spoken English and Chinese."
Senior Data Scientist,Hong Kong Industrial Artificial Intelligence and Robotics Centre Limited,"Science Park, Tai Po District",Consultants (Information & Communication Technology),Full time,"Hong Kong Industrial Artificial Intelligence and Robotics Centre Limited (Flair)Senior Data ScientistRef: Flair296/24, 9782Who are we:The Hong Kong Productivity Council (HKPC) and the RWTH Aachen Campus from Germany join forces to establish the Hong Kong Industrial Artificial Intelligence & Robotics Centre (FLAIR). Located at the Hong Kong Science Park, FLAIR is part of AIR@InnoHK, which is one of the two world-class research clusters being established by InnoHK Clusters of the HKSAR Government, to support Hong Kong in developing into an international innovation & technology hub.As the sole founder, HKPC will work together with RWTH Aachen Campus, the major collaborator of FLAIR, by bundling their strengths and repertoire of resources in technical expertise, networks, innovation and patents etc. to set up the FLAIR and support its operation.Who we are looking for:Creativity in new ideas and future focus vision.Collaboration with colleagues and the community at large.Work Smart, Play Smart!What you'll do:Study the AI technology trends and applications for industries, especially the manufacturing industry, so as to identify the potential solutions for industries’ productivity improvement and upgradingPropose and evaluate technical ideas with other functional units so as to design a suitable solution on order prediction, PHM, fault diagnosis, quality forecast and so on against the requirements and demandsDefine the technical development roadmap of AI technology applications so as to work out the R&D tasks and implementation planBe responsible for the development and optimization of the industrial AI and machine learning algorithms of the specific application fieldsLead project team to carry out R&D tasks against the plans and complete the projects (including R&D work, project documents, technical report and paper, patents, etc.) as scheduled with high standardBuild up and maintain a good network with other professional organization so as to acquire new technologies and create synergyYou'll be a good fit if you have/are:Master or above Degree in Computer Science, Mathematics, Statistics, Intelligent Systems, related disciplines or equivalentAt least 6 years hands-on experience in data analysis with actual usersUnderstanding on AI and machine learning framework, such as Tensorflow, PyTorch, Pandas, Scikit-learn, etc., and experience in NodeJS, JavaScript, Python, R or similar languagesKnowledge of Linux and cloud application, such as Azure, AWS and GCP an advantageGood writing, presentation, communication and analytical skillsPassionate, self-motivated, and able to work independently and meet tight deadlinesApplicants may be considered for other positions if not matching the requirements of the subject positionNote:Applicant may be considered for other positions if not matching the requirements of the subject position.What we offer and What you’ll like here:•    Exciting new technology development (e.g. IoT, 5G, LoRA, AI etc.) to actualize your creative ideas•    Opportunities to work with our innovative and vibrant talents•    Embracing work flexibility (including Flexi-work hour)•    Dynamic and energetic culture with smart outfits & sport shoes•    Academic training scholarship to take your career up a notch•    MPF Top-up & dental benefit•    Medical benefits from Day 1 with extended coverage to dependent(s)Apply now if you’re ready to take the challenge!Flair will take into consideration both the quantitative and qualitative requirements of the position when selecting the suitable candidates. A competitive salary package commensurate with academic qualifications and experience will be offered.Applicants are welcome to submit application in 2 weeks from the posting date.  Recruitment will continue until the position is filled.Personal data collected will be used for recruitment purpose only.  Candidates not invited for interviews within 6 weeks may consider their applications unsuccessful and the applications will be disposed by FLAIR within 12 months."
Junior Cyber Security Analyst,Dimension Data China/Hong Kong Limited,Hong Kong,Help Desk & IT Support (Information & Communication Technology),Full time,"## Location:This is a remote position.## Responsibilities:1. **Incident Response**: Handle Level 1 incident response duties, including initial analysis, escalation, and resolution of security incidents.2. **Email Security**: Respond to internal user requests regarding phishing emails, ensuring prompt and effective resolution.3. **Malware Mitigation**: Address reports of malware infections or unwanted software downloads, taking necessary steps to mitigate risks and prevent future occurrences.4. **Continuous Learning**: Stay updated on the latest cyber security threats and trends to ensure our security measures are always one step ahead.## Requirements:1. Basic knowledge of cyber security principles and best practices.2. Experience in incident response is highly desirable.3. Familiarity with common security technologies (firewalls, IDS/IPS, etc.) and standards (ISO 27001, NIST, etc.).4. Strong problem-solving skills and the ability to work under pressure.5. Excellent communication skills, with the ability to explain complex security issues to non-technical colleagues.6. Cyber security certification (e.g., CompTIA Security+, CISSP) is a plus but not a must.## Work Schedule:This is a full-time position requiring 5 days of work per week, with flexibility to work 1-2 days on weekends (Saturday and/or Sunday) as needed."
Senior Data Engineer - Global F&B Organization - HKD$40k-45k + Bonus,David James Recruitment  China Limited,"Mong Kok, Yau Tsim Mong District",Engineering - Software (Information & Communication Technology),Full time,"Our client is a Global F&B organization based in Hong Kong. They are looking for a skilled and motivated Data Engineer to join their dynamic team. As a Data Engineer, you will play a key role in designing and implementing data solutions that drive their business growth and enhance their customer experience.Responsibilities:Collaborate with cross-functional teams to understand data requirements and design efficient data models that align with business objectives.Develop and maintain scalable data pipelines, ETL processes, and data integration workflows to ensure reliable and timely data delivery.Implement data governance and quality frameworks to ensure data accuracy, consistency, and compliance with industry standards.Optimize database systems for performance, scalability, and reliability.fStay up-to-date with the latest trends and technologies in data engineering and propose innovative solutions to improve data infrastructure and processes.Requirements:Bachelor's degree in Computer Science, Engineering, or a related field.Proven experience as a Data EngineerOver 5 year of work experience in Data EngineeringHands-on experience with data modeling, ETL processes, and data integration tools.Proficiency in Python, Spark, SQL, NoSQL and BI ToolsFluent in CantoneseTo Apply:If you are interested in this role, please send us your CV or call us on+852 3619 9860for a confidential chat."
Technology Specialists Data & AI,Microsoft Hong Kong Limited,"Cyberport, Southern District",Engineering - Software (Information & Communication Technology),Full time,"Microsoft’s mission is to empower every person and every organization on the planet to achieve more. As employees we come together with a growth mindset, innovate to empower others, and collaborate to realize our shared goals. Each day we build on our values of respect, integrity, and accountability to create a culture of inclusion where everyone can thrive at work and beyond.With continued growth in digital data and the desire to leverage data to address problems that touch all aspects of our lives, Microsoft’s is growing to meet these challenges! The Azure Data & AI team is hiring experienced Azure Technical Specialist to join agile and diverse team in Data Platform (Azure SQL, Azure Data Lake Gen2, Databricks, Azure Synapse Analytics, Microsoft Fabric) and AI technologies (Azure OpenAI Services, Azure Cognitive Services, Azure Machine Learning)The main goal of Azure Technology Specialist - Data & AI is to win the technical decision of customers to purchase and use Microsoft technology and cloud services, for both Relational and Non-Relational scenarios. This includes Azure SQL, Open-source databases, Azure Analytics platform including Azure Cosmos DB and Microsoft Fabric and the entire Azure AI Platform - Azure Machine Learning plus Azure OpenAI . The Technical Specialist is expected to help the customers' technical evaluators and decision makers to take the best decisions, as well as find new opportunities through their contacts and engagements for sales specialists to pursue. As a Technical Specialist, you work within a virtual team of technical, partner and consulting resources to help educate your customers at a technical level, demonstrate, and prove our solutions, and win the technical decision, allowing the team to achieve/exceed quarterly sales targets in your accounts. Being part of this team will allow you to maintain and develop your deep technical expertise across Microsoft and non-Microsoft cloud-based technologies. This opportunity will allow you to accelerate your career growth, honing your solution sales and collaboration skills, and deepening your cloud expertise."
Brand Partner Specialist - Territory (Data & AI),IBM China / Hong Kong Ltd,Hong Kong,Administrative Assistants (Administration & Office Support),Full time,"Your Role and ResponsibilitiesThe Software Solutions Brand Sales is responsible for developing solutions that address our client’s business needs and deliver client value, technical knowledge with integrated products knowledge is crucial. The Software Solutions Brand Sales will work to create solutions which are tailored to client’s business needs and integrate the capabilities in a way that is valued by the customer and superior to the competition through technical viewpoint. In this role, it is essential to be able to apply industry specific knowledge and experience to bring new business and technology insights to assigned clients, selling with technical capability on basic architectural view. Furthermore, you will work together with IBM partners and external system integration providers for selling software solutions by leveraging different approach of cold calling, digital marketing campaigns or any other innovative ways.Major Responsibilities:• Sell DataAI & Automation solutions with technical skillset.• Territory / pipeline management• Opportunity identification• Lead Proof of Concepts, demonstrations, client workshops and presentations• Quotes / pricing, and other proposal development activitiesRequired Technical and Professional Expertise• 8+ years of experience as software sales.• 5+ years in DataAI & Automation solution related fields.• Experienced sales background, solid record of achieving sales targets.• Excellent communication skill in English and Chinese and Client Relationship Skills• Great teaming skills, with a focus on creating client value.Preferred Technical and Professional Expertise• Experience in channel development or expand partner ecosystem is preferred.• Experience in key account coverage role is preferred.• Experience to deliver sales pitch to C-level is preferred.• IT technical background is preferred."
Brand Partner Specialist - Territory (Data & AI),IBM China / Hong Kong Ltd,Hong Kong,New Business Development (Sales),Full time,"The Software Solutions Brand Sales is responsible for developing solutions that address our client’s business needs and deliver client value, technical knowledge with integrated products knowledge is crucial. The Software Solutions Brand Sales will work to create solutions which are tailored to client’s business needs and integrate the capabilities in a way that is valued by the customer and superior to the competition through technical viewpoint. In this role, it is essential to be able to apply industry specific knowledge and experience to bring new business and technology insights to assigned clients, selling with technical capability on basic architectural view. Furthermore, you will work together with IBM partners and external system integration providers for selling software solutions by leveraging different approach of cold calling, digital marketing campaigns or any other innovative ways.Major Responsibilities:• Sell DataAI & Automation solutions with technical skillset.• Territory / pipeline management• Opportunity identification• Lead Proof of Concepts, demonstrations, client workshops and presentations• Quotes / pricing, and other proposal development activities"
Data Analyst/ Data Engineer,Ikas International (Asia) Limited,"Wan Chai, Wan Chai District",Engineering - Software (Information & Communication Technology),Contract/Temp,"Our client is a young and dynamic insurance firm looking for a Data Analyst and a Data Engineer for their development team.Responsibilities:Utilize statistical techniques, data mining methods, and data visualization tools to analyze large datasets, uncovering patterns, trends, and actionable insights.Interpret analytical findings and transform them into practical recommendations for business decision-makers.Create reports, dashboards, and visualizations that clearly communicate the outcomes of your analysis to management and other key stakeholders.Build and manage detailed dashboards, reports, and data visualizations that track financial performance, operational KPIs, and market trends.Architect and develop data models to monitor and report on business performance.Design, implement, and troubleshoot ETL (Extract, Transform, Load) processes.Requirements:Bachelor's degree in Computer Science, Data Science, Information Technology, or a related field.Exceptional analytical skills with a strong intuition for data; proficiency in tools such as PowerBI, Python, APIs, Tableau, and SQL is highly desirable.Demonstrated expertise in statistical analysis, data modeling, ETL frameworks, data visualization software, SQL, and database management.Practical experience in developing and maintaining application systems for regulatory reporting.Familiarity with cloud platforms, particularly Azure Cloud Platform, is a plus.Strong team collaboration skills with the ability to handle large volumes of data accurately and meet tight deadlines.If you think this is a great opportunity for you don't hesitate to apply below!"
(Senior) Data Engineer – (Prominent International Firm),Acton Consulting Limited,Hong Kong,Database Development & Administration (Information & Communication Technology),Full time,"Our client is a leading conglomerate with strong presence in the APAC region. They are now looking for data science talents to join our dynamic and rapidly expanding front office team. The job offers excellent opportunity for candidates to develop his/her career in IT Industry.(Senior) Data Engineer – (Prominent International Firm)Responsibilities:Develop new applications using existing data sets to create new products or improve services.Maintain existing applications by updating existing code or adding new features.Recognize and translate business needs into practical data engineering solutions.Ensure data quality and integrity, applying robust database concepts and data modelling expertise.Communicate with cross-functional teams to recognize business needs and fulfill different project demandRequirements:Diploma or degree in Data Engineering, Computer Science, Statistics or related field.Minimum 1 year of experience in ETL / pipeline or any data platformsSolid Experience in Visualization and SQL is necessary.Knowledge in Data Integration, Cloud Technologies and Cloud Integration is preferred but not a MUSTSelf-initiated and have a strong drive to learnGood analytical, problem-solving and communication skills and disciplinedGood command in Cantonese and EnglishInterested parties please send full resume in MS WORD format stating current salary, expected salary and availability to us for details.WebSite: www.ActonCL.comAll information received will be kept in strict confidence and only for employment-related purposes."
